{
  "schemaVersion": "1",
  "case": "accepted",
  "request": {
    "method": "POST",
    "path": "/v1/event-ingests",
    "headers": {
      "Authorization": "Hookship-HMAC Credential=cred_test_01,Signature=lAaAdzTJfPJSb2EO_3oGM0ykD3OXt7dr0MEZk8NrfrM",
      "X-Hookship-Timestamp": "2026-07-19T16:00:00Z",
      "X-Hookship-Nonce": "bm9uY2UtdGVzdC0wMDAx",
      "Idempotency-Key": "order-create-0001",
      "X-Hookship-Event-ID": "evt_order_0001",
      "X-Hookship-Event-Type": "order.created",
      "X-Hookship-Route": "orders.primary",
      "X-Hookship-Body-SHA256": "2dfcf2896980dd2a7a3166da50dbb2c5524a746e64ab5c4de44d2012c74074d3",
      "Content-Type": "application/json"
    },
    "bodyBase64": "eyJvcmRlcl9pZCI6IjEyMyIsImFtb3VudCI6MTIuNTB9Cg=="
  },
  "expected": {
    "status": 202,
    "headers": {
      "Content-Type": "application/json",
      "Location": "/v1/event-ingests/ing_01J4M6Y7N8P9Q0R1S2T3U4V5W6",
      "Hookship-Request-Id": "req_01J4M6Y7N8P9Q0R1S2T3U4V5W7",
      "Hookship-Ingest-Id": "ing_01J4M6Y7N8P9Q0R1S2T3U4V5W6",
      "Hookship-Duplicate": "false",
      "Hookship-Idempotency-Expires-At": "2026-07-20T16:00:00Z"
    },
    "body": {
      "schemaVersion": "1",
      "ingestId": "ing_01J4M6Y7N8P9Q0R1S2T3U4V5W6",
      "eventId": "evt_order_0001",
      "eventType": "order.created",
      "route": "orders.primary",
      "contentType": "application/json",
      "bodySha256": "2dfcf2896980dd2a7a3166da50dbb2c5524a746e64ab5c4de44d2012c74074d3",
      "acceptedAt": "2026-07-19T16:00:00Z",
      "idempotencyExpiresAt": "2026-07-20T16:00:00Z",
      "idempotencyState": "committed",
      "state": "durable",
      "duplicate": false,
      "statusPath": "/v1/event-ingests/ing_01J4M6Y7N8P9Q0R1S2T3U4V5W6"
    }
  }
}
